link|title|description
http://arxiv.org/abs/1903.12061|Depth  from  a  polarisation  +  RGB  stereo  pair.  (arXiv:1903.12061v1  [cs.CV])|<p>In  this  paper,  we  propose  a  hybrid  depth  imaging  system  in  which  apolarisation  camera  is  augmented  by  a  second  image  from  a  standard  digitalcamera.  For  this  modest  increase  in  equipment  complexity  over  conventionalshape-from-polarisation,  we  obtain  a  number  of  benefits  that  enable  us  toovercome  longstanding  problems  with  the  polarisation  shape  cue.  The  stereo  cueprovides  a  depth  map  which,  although  coarse,  is  metrically  accurate.  This  isused  as  a  guide  surface  for  disambiguation  of  the  polarisation  surface  normalestimates  using  a  higher  order  graphical  model.  In  turn,  these  are  used  toestimate  diffuse  albedo.  By  extending  a  previous  shape-from-polarisation  methodto  the  perspective  case,  we  show  how  to  compute  dense,  detailed  maps  ofabsolute  depth,  while  retaining  a  linear  formulation.  We  show  that  our  hybridmethod  is  able  to  recover  dense  3D  geometry  that  is  superior  tostate-of-the-art  shape-from-polarisation  or  two  view  stereo  alone.</p>
http://arxiv.org/abs/1903.12063|Robust,  fast  and  accurate:  a  3-step  method  for  automatic  histological  image  registration.  (arXiv:1903.12063v1  [cs.CV])|<p>We  present  a  3-step  registration  pipeline  for  differently  stainedhistological  serial  sections  that  consists  of  1)  a  robust  pre-alignment,  2)  aparametric  registration  computed  on  coarse  resolution  images,  and  3)  anaccurate  nonlinear  registration.  In  all  three  steps  the  NGF  distance  measure  isminimized  with  respect  to  an  increasingly  flexible  transformation.  We  apply  themethod  in  the  ANHIR  image  registration  challenge  and  evaluate  its  performanceon  the  training  data.  The  presented  method  is  robust  (error  reduction  in  99.6%of  the  cases),  fast  (runtime  &lt;  4  seconds)  and  accurate  (median  relative  targetregistration  error  0.0019).</p>
http://arxiv.org/abs/1903.12064|Data4UrbanMobility:  Towards  Holistic  Data  Analytics  for  Mobility  Applications  in  Urban  Regions.  (arXiv:1903.12064v1  [cs.CY])|<p>With  the  increasing  availability  of  mobility-related  data,  such  asGPS-traces,  Web  queries  and  climate  conditions,  there  is  a  growing  demand  toutilize  this  data  to  better  understand  and  support  urban  mobility  needs.However,  data  available  from  the  individual  actors,  such  as  providers  ofinformation,  navigation  and  transportation  systems,  is  mostly  restricted  toisolated  mobility  modes,  whereas  holistic  data  analytics  over  integrated  datasources  is  not  sufficiently  supported.  In  this  paper  we  present  our  ongoingresearch  in  the  context  of  holistic  data  analytics  to  support  urban  mobilityapplications  in  the  Data4UrbanMobility  (D4UM)  project.  First,  we  discusschallenges  in  urban  mobility  analytics  and  present  the  D4UM  platform  we  arecurrently  developing  to  facilitate  holistic  urban  data  analytics  overintegrated  heterogeneous  data  sources  along  with  the  available  data  sources.Second,  we  present  the  MiC  app  -  a  tool  we  developed  to  complement  availabledatasets  with  intermodal  mobility  data  (i.e.  data  about  journeys  that  involvemore  than  one  mode  of  mobility)  using  a  citizen  science  approach.  Finally,  wepresent  selected  use  cases  and  discuss  our  future  work.</p>
http://arxiv.org/abs/1903.12065|Optimal  Random  Sampling  from  Distributed  Streams  Revisited.  (arXiv:1903.12065v1  [cs.DC])|<p>We  give  an  improved  algorithm  for  drawing  a  random  sample  from  a  large  datastream  when  the  input  elements  are  distributed  across  multiple  sites  whichcommunicate  via  a  central  coordinator.  At  any  point  in  time  the  set  of  elementsheld  by  the  coordinator  represent  a  uniform  random  sample  from  the  set  of  allthe  elements  observed  so  far.  When  compared  with  prior  work,  our  algorithmsasymptotically  improve  the  total  number  of  messages  sent  in  the  system  as  wellas  the  computation  required  of  the  coordinator.  We  also  present  a  matchinglower  bound,  showing  that  our  protocol  sends  the  optimal  number  of  messages  upto  a  constant  factor  with  large  probability.  As  a  byproduct,  we  obtain  animproved  algorithm  for  finding  the  heavy  hitters  across  multiple  distributedsites.</p>
http://arxiv.org/abs/1903.12069|The  Virtual  Doctor:  An  Interactive  Artificial  Intelligence  based  on  Deep  Learning  for  Non-Invasive  Prediction  of  Diabetes.  (arXiv:1903.12069v1  [cs.CY])|<p>Artificial  intelligence  (AI)  will  pave  the  way  to  a  new  era  in  medicine.However,  currently  available  AI  systems  do  not  interact  with  a  patient,  e.g.,for  anamnesis,  and  thus  are  only  used  by  the  physicians  for  predictions  indiagnosis  or  prognosis.  However,  these  systems  are  widely  used,  e.g.,  indiabetes  or  cancer  prediction.  In  the  current  study,  we  developed  an  AI  that  isable  to  interact  with  a  patient  (virtual  doctor)  by  using  a  speech  recognitionand  speech  synthesis  system  and  thus  can  autonomously  interact  with  thepatient,  which  is  particularly  important  for,  e.g.,  rural  areas,  where  theavailability  of  primary  medical  care  is  strongly  limited  by  low  populationdensities.  As  a  proof-of-concept,  the  system  is  able  to  predict  type  2  diabetesmellitus  (T2DM)  based  on  non-invasive  sensors  and  deep  neural  networks.Moreover,  the  system  provides  an  easy-to-interpret  probability  estimation  forT2DM  for  a  given  patient.  Besides  the  development  of  the  AI,  we  furtheranalyzed  the  acceptance  of  young  people  for  AI  in  healthcare  to  estimate  theimpact  of  such  system  in  the  future.</p>
http://arxiv.org/abs/1903.12070|Comprehensive  Analysis  of  Dynamic  Message  Sign  Impact  on  Driver  Behavior:  A  Random  Forest  Approach.  (arXiv:1903.12070v1  [cs.CY])|<p>This  study  investigates  the  potential  effects  of  different  Dynamic  MessageSigns  (DMSs)  on  driver  behavior  using  a  full-scale  high-fidelity  drivingsimulator.  Different  DMSs  are  categorized  by  their  content,  structure,  and  typeof  messages.  A  random  forest  algorithm  is  used  for  three  separate  behavioralanalyses;  a  route  diversion  analysis,  a  route  choice  analysis  and  a  complianceanalysis;  to  identify  the  potential  and  relative  influences  of  different  DMSson  these  aspects  of  driver  behavior.  A  total  of  390  simulation  runs  areconducted  using  a  sample  of  65  participants  from  diverse  socioeconomicbackgrounds.  Results  obtained  suggest  that  DMSs  displaying  lane  closure  anddelay  information  with  advisory  messages  are  most  influential  with  regards  todiversion  while  color-coded  DMSs  and  DMSs  with  avoid  route  advice  are  the  topcontributors  impacting  route  choice  decisions  and  DMS  compliance.  In  thisfirst-of-a-kind  study,  based  on  the  responses  to  the  pre  and  post  simulationsurveys  as  well  as  results  obtained  from  the  analysis  ofdriving-simulation-session  data,  the  authors  found  that  color-blind-friendly,color-coded  DMSs  are  more  effective  than  alphanumeric  DMSs  -  especially  inscenarios  that  demand  high  compliance  from  drivers.  The  increased  effectivenessmay  be  attributed  to  reduced  comprehension  time  and  ease  with  which  such  DMSsare  understood  by  a  greater  percentage  of  road  users.</p>
http://arxiv.org/abs/1903.12071|Big  Data  Analytics  and  AI  in  Mental  Healthcare.  (arXiv:1903.12071v1  [cs.CY])|<p>Mental  health  conditions  cause  a  great  deal  of  distress  or  impairment;depression  alone  will  affect  11%  of  the  world's  population.  The  application  ofArtificial  Intelligence  (AI)  and  big-data  technologies  to  mental  health  hasgreat  potential  for  personalizing  treatment  selection,  prognosticating,monitoring  for  relapse,  detecting  and  helping  to  prevent  mental  healthconditions  before  they  reach  clinical-level  symptomatology,  and  even  deliveringsome  treatments.  However,  unlike  similar  applications  in  other  fields  ofmedicine,  there  are  several  unique  challenges  in  mental  health  applicationswhich  currently  pose  barriers  towards  the  implementation  of  these  technologies.Specifically,  there  are  very  few  widely  used  or  validated  biomarkers  in  mentalhealth,  leading  to  a  heavy  reliance  on  patient  and  clinician  derivedquestionnaire  data  as  well  as  interpretation  of  new  signals  such  as  digitalphenotyping.  In  addition,  diagnosis  also  lacks  the  same  objective  'goldstandard'  as  in  other  conditions  such  as  oncology,  where  clinicians  andresearchers  can  often  rely  on  pathological  analysis  for  confirmation  ofdiagnosis.  In  this  chapter  we  discuss  the  major  opportunities,  limitations  andtechniques  used  for  improving  mental  healthcare  through  AI  and  big-data.  Weexplore  both  the  computational,  clinical  and  ethical  considerations  and  bestpractices  as  well  as  lay  out  the  major  researcher  directions  for  the  nearfuture.</p>
http://arxiv.org/abs/1903.12073|Scope  of  Research  on  Particle  Swarm  Optimization  Based  Data  Clustering.  (arXiv:1903.12073v1  [cs.NE])|<p>Optimization  is  nothing  but  a  mathematical  technique  which  finds  maxima  orminima  of  any  function  of  concern  in  some  realistic  region.  Differentoptimization  techniques  are  proposed  which  are  competing  for  the  best  solution.Particle  Swarm  Optimization  (PSO)  is  a  new,  advanced,  and  most  powerfuloptimization  methodology  that  performs  empirically  well  on  several  optimizationproblems.  It  is  the  extensively  used  Swarm  Intelligence  (SI)  inspiredoptimization  algorithm  used  for  finding  the  global  optimal  solution  in  amultifaceted  search  region.  Data  clustering  is  one  of  the  challenging  realworld  applications  that  invite  the  eminent  research  works  in  variety  of  fields.Applicability  of  different  PSO  variants  to  data  clustering  is  studied  in  theliterature,  and  the  analyzed  research  work  shows  that,  PSO  variants  give  poorresults  for  multidimensional  data.  This  paper  describes  the  differentchallenges  associated  with  multidimensional  data  clustering  and  scope  ofresearch  on  optimizing  the  clustering  problems  using  PSO.  We  also  propose  astrategy  to  use  hybrid  PSO  variant  for  clustering  multidimensional  numerical,text  and  image  data.</p>
http://arxiv.org/abs/1903.12074|Interpretation  of  machine  learning  predictions  for  patient  outcomes  in  electronic  health  records.  (arXiv:1903.12074v1  [cs.CY])|<p>Electronic  health  records  are  an  increasingly  important  resource  forunderstanding  the  interactions  between  patient  health,  environment,  andclinical  decisions.  In  this  paper  we  report  an  empirical  study  of  predictivemodeling  of  several  patient  outcomes  using  three  state-of-the-art  machinelearning  methods.  Our  primary  goal  is  to  validate  the  models  by  interpretingthe  importance  of  predictors  in  the  final  models.  Central  to  interpretation  isthe  use  of  feature  importance  scores,  which  vary  depending  on  the  underlyingmethodology.  In  order  to  assess  feature  importance,  we  compared  univariatestatistical  tests,  information-theoretic  measures,  permutation  testing,  andnormalized  coefficients  from  multivariate  logistic  regression  models.  Ingeneral  we  found  poor  correlation  between  methods  in  their  assessment  offeature  importance,  even  when  their  performance  is  comparable  and  relativelygood.  However,  permutation  tests  applied  to  random  forest  and  gradient  boostingmodels  showed  the  most  agreement,  and  the  importance  scores  matched  theclinical  interpretation  most  frequently.</p>
http://arxiv.org/abs/1903.12075|An  Empirical  Exploration  on  the  Supervision  of  PhD  Students  Closely  Collaborating  with  Industry.  (arXiv:1903.12075v1  [cs.CY])|<p>With  an  increase  of  PhD  students  working  in  industry,  there  is  a  need  tounderstand  what  factors  are  influencing  supervision  for  industrial  students.This  paper  aims  at  exploring  the  challenges  and  good  approaches  to  supervisionof  industrial  PhD  students.  Data  was  collected  through  semi-structuredinterviews  of  six  PhD  students  and  supervisors  with  experience  in  PhD  studiesat  several  organizations  in  the  embedded  software  industry  in  Sweden.  The  datawas  anonymized  and  it  was  analyzed  by  means  of  thematic  analysis.  The  resultsindicate  that  there  are  many  challenges  and  opportunities  to  improve  thesupervision  of  industrial  PhD  students.</p>
http://arxiv.org/abs/1903.12076|Toward  a  fitness  landscape  model  of  firms'  IT-enabled  dynamic  capabilities.  (arXiv:1903.12076v1  [cs.CY])|<p>This  chapter  presents,  extends  and  integrates  a  complexity  scienceperspective  and  applies  this  to  IT-enabled  dynamic  capabilities  (ITDCs)  offirms.  By  doing  so,  this  chapter  leverages  statistical  survey  data  and  usesthem  as  parameters  for  a  simulation  using  the  NK-model.  This  NK-model  createsstochastically  generated  fitness  landscapes  that  are  parameterized  using  afinite  number  of  (N)  elements,  or  capabilities,  and  (K)  complex  interactionsbetween  those  capabilities,  and  studies  the  performance  (fitness)  of  systems.We  simulate  firm  efforts  to  adaptively  explore  and  walk  through  a  fitnesslandscape  of  possible  strategies  of  inter-related  capabilities  to  reach  towardhigher  levels  of  fitness  of  ITDCs.  Also,  our  fitness  landscape  model  providesrealistic  scenarios  with  a  nexus  of  possible  business  strategies  that  can  beemployed  considering  the  current  status,  interdependency,  and  alignment  amongcapabilities  in  the  organization.  Our  work  suggests  that  firms  achieve  thehighest  fitness  values  when  the  interdependency  among  the  individualcapabilities  is  relatively  small.</p>
http://arxiv.org/abs/1903.12079|Deterrence  and  Prevention-based  Model  to  Mitigate  Information  Security  Insider  Threats  in  Organisations.  (arXiv:1903.12079v1  [cs.CY])|<p>Previous  studies  show  that  information  security  breaches  and  privacyviolations  are  important  issues  for  organisations  and  people.  It  isacknowledged  that  decreasing  the  risk  in  this  domain  requires  consideration  ofthe  technological  aspects  of  information  security  alongside  human  aspects.Employees  intentionally  or  unintentionally  account  for  a  significant  portion  ofthe  threats  to  information  assets  in  organisations.  This  research  presents  anovel  conceptual  framework  to  mitigate  the  risk  of  insiders  using  deterrenceand  prevention  approaches.  Deterrence  factors  discourage  employees  fromengaging  in  information  security  misbehaviour  in  organisations,  and  situationalcrime  prevention  factors  encourage  them  to  prevent  information  securitymisconduct.  Our  findings  show  that  perceived  sanctions  certainty  and  severitysignificantly  influence  individuals'  attitudes  and  deter  them  from  informationsecurity  misconduct.  In  addition,  the  output  revealed  that  increasing  theeffort,  risk  and  reducing  the  reward  (benefits  of  crime)  influence  theemployees'  attitudes  towards  prevent  information  security  misbehaviour.However,  removing  excuses  and  reducing  provocations  do  not  significantlyinfluence  individuals'  attitudes  towards  prevent  information  securitymisconduct.  Finally,  the  output  of  the  data  analysis  also  showed  thatsubjective  norms,  perceived  behavioural  control  and  attitude  influenceindividuals'  intentions,  and,  ultimately,  their  behaviour  towards  avoidinginformation  security  misbehaviour.</p>
http://arxiv.org/abs/1903.12080|Detecting  Activities  of  Daily  Living  and  Routine  Behaviours  in  Dementia  Patients  Living  Alone  Using  Smart  Meter  Load  Disaggregation.  (arXiv:1903.12080v1  [cs.CY])|<p>The  emergence  of  an  ageing  population  is  a  significant  public  health  concern.This  has  led  to  an  increase  in  the  number  of  people  living  with  progressiveneurodegenerative  disorders  like  dementia.  Consequently,  the  strain  this  isplaces  on  health  and  social  care  services  means  providing  24-hour  monitoring  isnot  sustainable.  Technological  intervention  is  being  considered,  however  nosolution  exists  to  non-intrusively  monitor  the  independent  living  needs  ofpatients  with  dementia.  As  a  result  many  patients  hit  crisis  point  beforeintervention  and  support  is  provided.  In  parallel,  patient  care  relies  onfeedback  from  informal  carers  about  significant  behavioural  changes.  Yet,  notall  people  have  a  social  support  network  and  early  intervention  in  dementiacare  is  often  missed.  The  smart  meter  rollout  has  the  potential  to  change  this.Using  machine  learning  and  signal  processing  techniques,  a  home  energy  supplycan  be  disaggregated  to  detect  which  home  appliances  are  turned  on  and  off.This  will  allow  Activities  of  Daily  Living  (ADLs)  to  be  assessed,  such  aseating  and  drinking,  and  observed  changes  in  routine  to  be  detected  for  earlyintervention.  The  primary  aim  is  to  help  reduce  deterioration  and  enablepatients  to  stay  in  their  homes  for  longer.  A  Support  Vector  Machine  (SVM)  andRandom  Decision  Forest  classifier  are  modelled  using  data  from  three  testhomes.  The  trained  models  are  then  used  to  monitor  two  patients  with  dementiaduring  a  six-month  clinical  trial  undertaken  in  partnership  with  Mersey  CareNHS  Foundation  Trust.  In  the  case  of  load  disaggregation  for  appliancedetection,  the  SVM  achieved  (AUC=0.86074,  Sen=0.756  and  Spec=0.92838).  Whilethe  Decision  Forest  achieved  (AUC=0.9429,  Sen=0.9634  and  Spec=0.9634).  ADLs  arealso  analysed  to  identify  the  behavioural  patterns  of  the  occupant  whiledetecting  alterations  in  routine.</p>
http://arxiv.org/abs/1903.12084|Definition  of  Internet  of  Things  (IoT)  Cyber  Risk  Discussion  on  a  Transformation  Roadmap  for  Standardisation  of  Regulations  Risk  Maturity  Strategy  Design  and  Impact  Assessment.  (arXiv:1903.12084v1  [cs.CR])|<p>A  comparative  empirical  analysis  is  performed  to  define  a  high-levelpotential  target  state  followed  by  a  high-level  transformation  roadmap,describing  how  company  can  achieve  their  target  state,  based  on  their  currentstate.  The  transformation  roadmap  is  used  to  adapt  the  Goal-Oriented  Approachand  the  IoT  Micro  Mart  model.</p>
http://arxiv.org/abs/1903.12085|More  Parallelism  in  Dijkstra's  Single-Source  Shortest  Path  Algorithm.  (arXiv:1903.12085v1  [cs.DC])|<p>Dijkstra's  algorithm  for  the  Single-Source  Shortest  Path  (SSSP)  problem  isnotoriously  hard  to  parallelize  in  $o(n)$  depth,  $n$  being  the  number  ofvertices  in  the  input  graph,  without  increasing  the  required  parallel  workunreasonably.  Crauser  et  al.  (1998)  presented  observations  that  allow  toidentify  more  than  a  single  vertex  at  a  time  as  correct  and  correspondinglymore  edges  to  be  relaxed  simultaneously.  Their  algorithm  runs  in  parallelphases,  and  for  certain  random  graphs  they  showed  that  the  number  of  phases  is$O(n^{1/3})$  with  high  probability.  A  work-efficient  CRCW  PRAM  with  this  depthwas  given,  but  no  implementation  on  a  real,  parallel  system.</p><p>In  this  paper  we  strengthen  the  criteria  of  Crauser  et  al.,  and  discusstradeoffs  between  work  and  number  of  phases  in  their  implementation.  We  presentsimulation  results  with  a  range  of  common  input  graphs  for  the  depth  that  anideal  parallel  algorithm  that  can  apply  the  criteria  at  no  cost  and  parallelizerelaxations  without  conflicts  can  achieve.  These  results  show  that  the  numberof  phases  is  indeed  a  small  root  of  $n$,  but  still  off  from  the  shortest  pathlength  lower  bound  that  can  also  be  computed.</p><p>We  give  a  shared-memory  parallel  implementation  of  the  most  work-efficientversion  of  a  Dijkstra's  algorithm  running  in  parallel  phases,  which  we  compareto  an  own  implementation  of  the  well-known  $Delta$-stepping  algorithm.  We  canshow  that  the  work-efficient  SSSP  algorithm  applying  the  criteria  of  Crauser  etal.  is  competitive  to  and  often  better  than  $Delta$-stepping  on  our  choseninput  graphs.  Despite  not  providing  an  $o(n)$  guarantee  on  the  number  ofrequired  phases,  criteria  allowing  concurrent  relaxation  of  many  correctvertices  may  be  a  viable  approach  to  practically  fast,  parallel  SSSPimplementations.</p>
http://arxiv.org/abs/1903.12086|Towards  a  Theory  of  Systems  Engineering  Processes:  A  Principal-Agent  Model  of  a  One-Shot,  Shallow  Process.  (arXiv:1903.12086v1  [cs.MA])|<p>Systems  engineering  processes  coordinate  the  effort  of  different  individualsto  generate  a  product  satisfying  certain  requirements.  As  the  involvedengineers  are  self-interested  agents,  the  goals  at  different  levels  of  thesystems  engineering  hierarchy  may  deviate  from  the  system-level  goals  which  maycause  budget  and  schedule  overruns.  Therefore,  there  is  a  need  of  a  systemsengineering  theory  that  accounts  for  the  human  behavior  in  systems  design.  Tothis  end,  the  objective  of  this  paper  is  to  develop  and  analyze  aprincipal-agent  model  of  a  one-shot  (single  iteration),  shallow  (one  level  ofhierarchy)  systems  engineering  process.  We  assume  that  the  systems  engineermaximizes  the  expected  utility  of  the  system,  while  the  subsystem  engineersseek  to  maximize  their  expected  utilities.  Furthermore,  the  systems  engineer  isunable  to  monitor  the  effort  of  the  subsystem  engineer  and  may  not  have  acomplete  information  about  their  types  or  the  complexity  of  the  design  task.However,  the  systems  engineer  can  incentivize  the  subsystem  engineers  byproposing  specific  contracts.  To  obtain  an  optimal  incentive,  we  pose  and  solvenumerically  a  bi-level  optimization  problem.  Through  extensive  simulations,  westudy  the  optimal  incentives  arising  from  different  system-level  valuefunctions  under  various  combinations  of  effort  costs,  problem-solving  skills,and  task  complexities.</p>
http://arxiv.org/abs/1903.12087|A  Real-Time  Wideband  Neural  Vocoder  at  1.6  kb/s  Using  LPCNet.  (arXiv:1903.12087v1  [eess.AS])|<p>Neural  speech  synthesis  algorithms  are  a  promising  new  approach  for  codingspeech  at  very  low  bitrate.  They  have  so  far  demonstrated  quality  that  farexceeds  traditional  vocoders,  at  the  cost  of  very  high  complexity.  In  thiswork,  we  present  a  low-bitrate  neural  vocoder  based  on  the  LPCNet  model.  Theuse  of  linear  prediction  and  sparse  recurrent  networks  makes  it  possible  toachieve  real-time  operation  on  general-purpose  hardware.  We  demonstrate  thatLPCNet  operating  at  1.6  kb/s  achieves  significantly  higher  quality  than  MELPand  that  uncompressed  LPCNet  can  exceed  the  quality  of  a  waveform  codecoperating  at  low  bitrate.  This  opens  the  way  for  new  codec  designs  based  onneural  synthesis  models.</p>
http://arxiv.org/abs/1903.12088|GANs-NQM:  A  Generative  Adversarial  Networks  based  No  Reference  Quality  Assessment  Metric  for  RGB-D  Synthesized  Views.  (arXiv:1903.12088v1  [cs.MM])|<p>In  this  paper,  we  proposed  a  no-reference  (NR)  quality  metric  for  RGB  plusimage-depth  (RGB-D)  synthesis  images  based  on  Generative  Adversarial  Networks(GANs),  namely  GANs-NQM.  Due  to  the  failure  of  the  inpainting  on  dis-occludedregions  in  RGB-D  synthesis  process,  to  capture  the  non-uniformly  distributedlocal  distortions  and  to  learn  their  impact  on  perceptual  quality  arechallenging  tasks  for  objective  quality  metrics.  In  our  study,  based  on  thecharacteristics  of  GANs,  we  proposed  i)  a  novel  training  strategy  of  GANs  forRGB-D  synthesis  images  using  existing  large-scale  computer  vision  datasetsrather  than  RGB-D  dataset;  ii)  a  referenceless  quality  metric  based  on  thetrained  discriminator  by  learning  a  `Bag  of  Distortion  Word'  (BDW)  codebook  anda  local  distortion  regions  selector;  iii)  a  hole  filling  inpainter,  i.e.,  thegenerator  of  the  trained  GANs,  for  RGB-D  dis-occluded  regions  as  a  sideoutcome.  According  to  the  experimental  results  on  IRCCyN/IVC  DIBR  database,  theproposed  model  outperforms  the  state-of-the-art  quality  metrics,  in  addition,is  more  applicable  in  real  scenarios.  The  corresponding  context  inpainter  alsoshows  appealing  results  over  other  inpainting  algorithms.</p>
