link|title|description
http://arxiv.org/abs/1903.11593|What  does  AI  see?  Deep  segmentation  networks  discover  biomarkers  for  lung  cancer  survival.  (arXiv:1903.11593v1  [eess.IV])|<p>Non-small-cell  lung  cancer  (NSCLC)  represents  approximately  80-85%  of  lungcancer  diagnoses  and  is  the  leading  cause  of  cancer-related  death  worldwide.Recent  studies  indicate  that  image-based  radiomics  features  from  positronemission  tomography-computed  tomography  (PET/CT)  images  have  predictive  poweron  NSCLC  outcomes.  To  this  end,  easily  calculated  functional  features  such  asthe  maximum  and  the  mean  of  standard  uptake  value  (SUV)  and  total  lesionglycolysis  (TLG)  are  most  commonly  used  for  NSCLC  prognostication,  but  theirprognostic  value  remains  controversial.  Meanwhile,  convolutional  neuralnetworks  (CNN)  are  rapidly  emerging  as  a  new  premise  for  cancer  image  analysis,with  significantly  enhanced  predictive  power  compared  to  other  hand-craftedradiomics  features.  Here  we  show  that  CNN  trained  to  perform  the  tumorsegmentation  task,  with  no  other  information  than  physician  contours,  identifya  rich  set  of  survival-related  image  features  with  remarkable  prognostic  value.In  a  retrospective  study  on  96  NSCLC  patients  before  stereotactic-bodyradiotherapy  (SBRT),  we  found  that  the  CNN  segmentation  algorithm  (U-Net)trained  for  tumor  segmentation  in  PET/CT  images,  contained  features  havingstrong  correlation  with  2-  and  5-year  overall  and  disease-specific  survivals.The  U-net  algorithm  has  not  seen  any  other  clinical  information  (e.g.  survival,age,  smoking  history)  than  the  images  and  the  corresponding  tumor  contoursprovided  by  physicians.  Furthermore,  through  visualization  of  the  U-Net,  wealso  found  convincing  evidence  that  the  regions  of  progression  appear  to  matchwith  the  regions  where  the  U-Net  features  identified  patterns  that  predictedhigher  likelihood  of  death.  We  anticipate  our  findings  will  be  a  starting  pointfor  more  sophisticated  non-intrusive  patient  specific  cancer  prognosisdetermination.</p>
http://arxiv.org/abs/1903.11596|Detecting  service  provider  alliances.  (arXiv:1903.11596v1  [cs.GT])|<p>We  present  an  algorithm  for  detecting  service  provider  alliances.  To  performthis,  we  modelize  a  cooperative  game-theoretic  model  for  competitor  serviceproviders.  A  choreography  (a  peer-to-peer  service  composition  model)  needs  aset  of  services  to  fulfill  its  requirements.  Users  must  choose,  for  eachrequirement,  which  service  providers  will  be  used  to  enact  the  choreography  atlowest  cost.  Due  to  the  lack  of  centralization,  vendors  can  form  alliances  tocontrol  the  market.  We  propose  a  novel  algorithm  capable  of  detecting  alliancesamong  service  providers,  based  on  our  findings  showing  that  this  game  has  anempty  core,  but  a  non-empty  bargaining  set.</p>
http://arxiv.org/abs/1903.11598|A  Simple  Haploid-Diploid  Evolutionary  Algorithm.  (arXiv:1903.11598v1  [cs.NE])|<p>It  has  recently  been  suggested  that  evolution  exploits  a  form  of  fitnesslandscape  smoothing  within  eukaryotic  sex  due  to  the  haploid-diploid  cycle.This  short  paper  presents  a  simple  modification  to  the  standard  evolutionarycomputing  algorithm  to  similarly  benefit  from  the  process.  Using  the  well-knownNK  model  of  fitness  landscapes  it  is  shown  that  the  benefit  emerges  asruggedness  is  increased.</p>
http://arxiv.org/abs/1903.11621|Self-adaptive  decision-making  mechanisms  to  balance  the  execution  of  multiple  tasks  for  a  multi-robots  team.  (arXiv:1903.11621v1  [cs.RO])|<p>This  work  addresses  the  coordination  problem  of  multiple  robots  with  the  goalof  finding  specific  hazardous  targets  in  an  unknown  area  and  dealing  with  themcooperatively.  The  desired  behaviour  for  the  robotic  system  entails  multiplerequirements,  which  may  also  be  conflicting.  The  paper  presents  the  problem  asa  constrained  bi-objective  optimization  problem  in  which  mobile  robots  mustperform  two  specific  tasks  of  exploration  and  at  same  time  cooperation  andcoordination  for  disarming  the  hazardous  targets.  These  objectives  are  opposedgoals,  in  which  one  may  be  favored,  but  only  at  the  expense  of  the  other.Therefore,  a  good  trade-off  must  be  found.  For  this  purpose,  a  nature-inspiredapproach  and  an  analytical  mathematical  model  to  solve  this  problem  consideringa  single  equivalent  weighted  objective  function  are  presented.  The  results  ofproposed  coordination  model,  simulated  in  a  two  dimensional  terrain,  are  showedin  order  to  assess  the  behaviour  of  the  proposed  solution  to  tackle  thisproblem.  We  have  analyzed  the  performance  of  the  approach  and  the  influence  ofthe  weights  of  the  objective  function  under  different  conditions:  static  anddynamic.  In  this  latter  situation,  the  robots  may  fail  under  the  stringentlimited  budget  of  energy  or  for  hazardous  events.  The  paper  concludes  with  acritical  discussion  of  the  experimental  results.</p>
http://arxiv.org/abs/1903.11626|Bridging  Adversarial  Robustness  and  Gradient  Interpretability.  (arXiv:1903.11626v1  [cs.LG])|<p>Adversarial  training  is  a  training  scheme  designed  to  counter  adversarialattacks  by  augmenting  the  training  dataset  with  adversarial  examples.Surprisingly,  several  studies  have  observed  that  loss  gradients  fromadversarially  trained  DNNs  are  visually  more  interpretable  than  those  fromstandard  DNNs.  Although  this  phenomenon  is  interesting,  there  are  only  fewworks  that  have  offered  an  explanation.  In  this  paper,  we  attempted  to  bridgethis  gap  between  adversarial  robustness  and  gradient  interpretability.  To  thisend,  we  identified  that  loss  gradients  from  adversarially  trained  DNNs  alignbetter  with  human  perception  because  adversarial  training  restricts  gradientscloser  to  the  image  manifold.  We  then  demonstrated  that  adversarial  trainingcauses  loss  gradients  to  be  quantitatively  meaningful.  Finally,  we  showed  thatunder  the  adversarial  training  framework,  there  exists  an  empirical  trade-offbetween  test  accuracy  and  loss  gradient  interpretability  and  proposed  twopotential  approaches  to  resolving  this  trade-off.</p>
http://arxiv.org/abs/1903.11633|Laplace  Landmark  Localization.  (arXiv:1903.11633v1  [cs.CV])|<p>Landmark  localization  in  images  and  videos  is  a  classic  problem  solved  invarious  ways.  Nowadays,  with  deep  networks  prevailing  throughout  machinelearning,  there  are  revamped  interests  in  pushing  facial  landmark  detectiontechnologies  to  handle  more  challenging  data.  Most  efforts  use  networkobjectives  based  on  L1  or  L2  norms,  which  have  several  disadvantages.  First  ofall,  the  locations  of  landmarks  are  determined  from  generated  heatmaps  (i.e.,confidence  maps)  from  which  predicted  landmark  locations  (i.e.,  the  means)  getpenalized  without  accounting  for  the  spread:  a  high  scatter  corresponds  to  lowconfidence  and  vice-versa.  For  this,  we  introduce  a  LaplaceKL  objective  thatpenalizes  for  a  low  confidence.  Another  issue  is  a  dependency  on  labeled  data,which  are  expensive  to  obtain  and  susceptible  to  error.  To  address  both  issueswe  propose  an  adversarial  training  framework  that  leverages  unlabeled  data  toimprove  model  performance.  Our  method  claims  state-of-the-art  on  all  of  the300W  benchmarks  and  ranks  second-to-best  on  the  Annotated  Facial  Landmarks  inthe  Wild  (AFLW)  dataset.  Furthermore,  our  model  is  robust  with  a  reduced  size:1/8  the  number  of  channels  (i.e.,  0.0398MB)  is  comparable  to  state-of-that-artin  real-time  on  CPU.  Thus,  we  show  that  our  method  is  of  high  practical  valueto  real-life  application.</p>
http://arxiv.org/abs/1903.11635|Fourier  Entropy-Influence  Conjecture  for  Random  Linear  Threshold  Functions.  (arXiv:1903.11635v1  [cs.CC])|<p>The  Fourier-Entropy  Influence  (FEI)  Conjecture  states  that  for  any  Booleanfunction  $f:{+1,-1}^n  	o  {+1,-1}$,  the  Fourier  entropy  of  $f$  is  at  mostits  influence  up  to  a  universal  constant  factor.  While  the  FEI  conjecture  hasbeen  proved  for  many  classes  of  Boolean  functions,  it  is  still  not  knownwhether  it  holds  for  the  class  of  Linear  Threshold  Functions.  A  naturalquestion  is:  Does  the  FEI  conjecture  hold  for  a  `random'  linear  thresholdfunction?  In  this  paper,  we  answer  this  question  in  the  affirmative.  Weconsider  two  natural  distributions  on  the  weights  defining  a  linear  thresholdfunction,  namely  uniform  distribution  on  $[-1,1]$  and  Normal  distribution.</p>
http://arxiv.org/abs/1903.11640|Fundamental  Limits  of  Covert  Packet  Insertion.  (arXiv:1903.11640v1  [cs.CR])|<p>Covert  communication  conceals  the  existence  of  the  transmission  from  awatchful  adversary.  We  consider  the  fundamental  limits  for  covertcommunications  via  packet  insertion  over  packet  channels  whose  packet  timingsare  governed  by  a  renewal  process  of  rate  $lambda$.  Authorized  transmitterJack  sends  packets  to  authorized  receiver  Steve,  and  covert  transmitter  Alicewishes  to  transmit  packets  to  covert  receiver  Bob  without  being  detected  bywatchful  adversary  Willie.  Willie  cannot  authenticate  the  source  of  thepackets.  Hence,  he  looks  for  statistical  anomalies  in  the  packet  stream  fromJack  to  Steve  to  attempt  detection  of  unauthorized  packet  insertion.  First,  weconsider  a  special  case  where  the  packet  timings  are  governed  by  a  Poissonprocess  and  we  show  that  Alice  can  covertly  insert  $mathcal{O}(sqrt{lambdaT})$  packets  for  Bob  in  a  time  interval  of  length  $T$;  conversely,  if  Aliceinserts  $omega(sqrt{lambda  T})$,  she  will  be  detected  by  Willie  with  highprobability.  Then,  we  extend  our  results  to  general  renewal  channels  and  showthat  in  a  stream  of  $N$  packets  transmitted  by  Jack,  Alice  can  covertly  insert$mathcal{O}(sqrt{N})$  packets;  if  she  inserts  $omega(sqrt{N})$  packets,  shewill  be  detected  by  Willie  with  high  probability.</p>
http://arxiv.org/abs/1903.11649|Align2Ground:  Weakly  Supervised  Phrase  Grounding  Guided  by  Image-Caption  Alignment.  (arXiv:1903.11649v1  [cs.CV])|<p>We  address  the  problem  of  grounding  free-form  textual  phrases  by  using  weaksupervision  from  image-caption  pairs.  We  propose  a  novel  end-to-end  model  thatuses  caption-to-image  retrieval  as  a  `downstream'  task  to  guide  the  process  ofphrase  localization.  Our  method,  as  a  first  step,  infers  the  latentcorrespondences  between  regions-of-interest  (RoIs)  and  phrases  in  the  captionand  creates  a  discriminative  image  representation  using  these  matched  RoIs.  Ina  subsequent  step,  this  (learned)  representation  is  aligned  with  the  caption.Our  key  contribution  lies  in  building  this  `caption-conditioned'  image  encodingwhich  tightly  couples  both  the  tasks  and  allows  the  weak  supervision  toeffectively  guide  visual  grounding.  We  provide  an  extensive  empirical  andqualitative  analysis  to  investigate  the  different  components  of  our  proposedmodel  and  compare  it  with  competitive  baselines.  For  phrase  localization,  wereport  an  improvement  of  4.9%  (absolute)  over  the  prior  state-of-the-art  on  theVisualGenome  dataset.  We  also  report  results  that  are  at  par  with  thestate-of-the-art  on  the  downstream  caption-to-image  retrieval  task  on  COCO  andFlickr30k  datasets.</p>
http://arxiv.org/abs/1903.11650|Lens-based  Millimeter  Wave  Reconfigurable  Antenna  NOMA.  (arXiv:1903.11650v1  [cs.IT])|<p>This  paper  proposes  a  new  multiple  access  technique  based  on  the  millimeterwave  lens-based  reconfigurable  antenna  systems.  In  particular,  to  support  alarge  number  of  groups  of  users  with  different  angles  of  departures  (AoDs),  weintegrate  recently  proposed  reconfigurable  antenna  multiple  access  (RAMA)  intonon-orthogonal  multiple  access  (NOMA).  The  proposed  technique,  namedreconfigurable  antenna  NOMA  (RA-NOMA),  divides  the  users  with  respect  to  theirAoDs  and  channel  gains.  Users  with  different  AoDs  and  comparable  channel  gainsare  served  via  RAMA  while  users  with  the  same  AoDs  but  different  channel  gainsare  served  via  NOMA.  This  technique  results  in  the  independence  of  the  numberof  radio  frequency  chains  from  the  number  of  NOMA  groups.  Further,  we  derivethe  feasibility  conditions  and  show  that  the  power  allocation  for  RA-NOMA  is  aconvex  problem.  We  then  derive  the  maximum  achievable  sum-rate  of  RA-NOMA.Simulation  results  show  that  RA-NOMA  outperforms  conventional  orthogonalmultiple  access  (OMA)  as  well  as  the  combination  of  RAMA  with  the  OMAtechniques.</p>
http://arxiv.org/abs/1903.11665|Microservice  Transition  and  its  Granularity  Problem:  A  Systematic  Mapping  Study.  (arXiv:1903.11665v1  [cs.SE])|"<p>Microservices  have  gained  wide  recognition  and  acceptance  in  softwareindustries  as  an  emerging  architectural  style  for  autonomic,  scalable,  and  morereliable  computing.  The  transition  to  microservices  has  been  highly  motivatedby  the  need  for  better  alignment  of  technical  design  decisions  with  improvingvalue  potentials  of  architectures.  Despite  microservices'  popularity,  researchstill  lacks  disciplined  understanding  of  transition  and  consensus  on  theprinciples  and  activities  underlying  ""micro-ing""  architectures.  In  this  paper,we  report  on  a  systematic  mapping  study  that  consolidates  various  views,approaches  and  activities  that  commonly  assist  in  the  transition  tomicroservices.  The  study  aims  to  provide  a  better  understanding  of  thetransition;  it  also  contributes  a  working  definition  of  the  transition  andtechnical  activities  underlying  it.  We  term  the  transition  and  technicalactivities  leading  to  microservice  architectures  as  microservitization.  We  thenshed  light  on  a  fundamental  problem  of  microservitization:  microservicegranularity  and  reasoning  about  its  adaptation  as  first-class  entities.  Thisstudy  reviews  state-of-the-art  and  -practice  related  to  reasoning  aboutmicroservice  granularity;  it  reviews  modelling  approaches,  aspects  considered,guidelines  and  processes  used  to  reason  about  microservice  granularity.  Thisstudy  identifies  opportunities  for  future  research  and  development  related  toreasoning  about  microservice  granularity.</p>"
http://arxiv.org/abs/1903.11670|The  minimum  value  of  the  Colless  index.  (arXiv:1903.11670v1  [q-bio.PE])|<p>The  Colless  index  is  one  of  the  oldest  and  most  widely  used  balance  indicesfor  rooted  bifurcating  trees.  Despite  its  popularity,  its  minimum  value  on  thespace  $mathcal{T}_n$  of  rooted  bifurcating  trees  with  $n$  leaves  is  only  knownwhen  $n$  is  a  power  of  2.  In  this  paper  we  fill  this  gap  in  the  literature,  byproviding  a  formula  that  computes,  for  each  $n$,  the  minimum  Colless  index  on$mathcal{T}_n$,  and  characterizing  those  trees  where  this  minimum  value  isreached.</p>
http://arxiv.org/abs/1903.11672|MuSE-ing  on  the  Impact  of  Utterance  Ordering  On  Crowdsourced  Emotion  Annotations.  (arXiv:1903.11672v1  [cs.SD])|"<p>Emotion  recognition  algorithms  rely  on  data  annotated  with  high  qualitylabels.  However,  emotion  expression  and  perception  are  inherently  subjective.There  is  generally  not  a  single  annotation  that  can  be  unambiguously  declared""correct"".  As  a  result,  annotations  are  colored  by  the  manner  in  which  theywere  collected.  In  this  paper,  we  conduct  crowdsourcing  experiments  toinvestigate  this  impact  on  both  the  annotations  themselves  and  on  theperformance  of  these  algorithms.  We  focus  on  one  critical  question:  the  effectof  context.  We  present  a  new  emotion  dataset,  Multimodal  Stressed  Emotion(MuSE),  and  annotate  the  dataset  using  two  conditions:  randomized,  in  whichannotators  are  presented  with  clips  in  random  order,  and  contextualized,  inwhich  annotators  are  presented  with  clips  in  order.  We  find  that  contextuallabeling  schemes  result  in  annotations  that  are  more  similar  to  a  speaker's  ownself-reported  labels  and  that  labels  generated  from  randomized  schemes  are  mosteasily  predictable  by  automated  systems.</p>"
http://arxiv.org/abs/1903.11673|Adversarial  Deep  Learning  in  EEG  Biometrics.  (arXiv:1903.11673v1  [cs.LG])|<p>Deep  learning  methods  for  person  identification  based  onelectroencephalographic  (EEG)  brain  activity  encounters  the  problem  ofexploiting  the  temporally  correlated  structures  or  recording  session  specificvariability  within  EEG.  Furthermore,  recent  methods  have  mostly  trained  andevaluated  based  on  single  session  EEG  data.  We  address  this  problem  from  aninvariant  representation  learning  perspective.  We  propose  an  adversarialinference  approach  to  extend  such  deep  learning  models  to  learnsession-invariant  person-discriminative  representations  that  can  providerobustness  in  terms  of  longitudinal  usability.  Using  adversarial  learningwithin  a  deep  convolutional  network,  we  empirically  assess  and  showimprovements  with  our  approach  based  on  longitudinally  collected  EEG  data  forperson  identification  from  half-second  EEG  epochs.</p>
http://arxiv.org/abs/1903.11674|On  Inversely  Proportional  Hypermutations  with  Mutation  Potential.  (arXiv:1903.11674v1  [cs.NE])|<p>Artificial  Immune  Systems  (AIS)  employing  hypermutations  with  linear  staticmutation  potential  have  recently  been  shown  to  be  very  effective  at  escapinglocal  optima  of  combinatorial  optimisation  problems  at  the  expense  of  beingslower  during  the  exploitation  phase  compared  to  standard  evolutionaryalgorithms.  In  this  paper  we  prove  that  considerable  speed-ups  in  theexploitation  phase  may  be  achieved  with  dynamic  inversely  proportional  mutationpotentials  (IPM)  and  argue  that  the  potential  should  decrease  inversely  to  thedistance  to  the  optimum  rather  than  to  the  difference  in  fitness.  Afterwards  wedefine  a  simple  (1+1)~Opt-IA,  that  uses  IPM  hypermutations  and  ageing,  forrealistic  applications  where  optimal  solutions  are  unknown.  The  aim  of  the  AISis  to  approximate  the  ideal  behaviour  of  the  inversely  proportionalhypermutations  better  and  better  as  the  search  space  is  explored.  We  prove  thatsuch  desired  behaviour,  and  related  speed-ups,  occur  for  a  well-studied  bimodalbenchmark  function  called  	extsc{TwoMax}.  Furthermore,  we  prove  that  the(1+1)~Opt-IA  with  IPM  efficiently  optimises  a  third  bimodal  function,	extsc{Cliff},  by  escaping  its  local  optima  while  Opt-IA  with  static  potentialcannot,  thus  requires  exponential  expected  runtime  in  the  distance  between  thecliff  and  the  optimum.</p>
http://arxiv.org/abs/1903.11677|Exact  Byzantine  Consensus  on  Undirected  Graphs  under  Local  Broadcast  Model.  (arXiv:1903.11677v1  [cs.DC])|<p>This  paper  considers  the  Byzantine  consensus  problem  for  nodes  with  binaryinputs.  The  nodes  are  interconnected  by  a  network  represented  as  an  undirectedgraph,  and  the  system  is  assumed  to  be  synchronous.  Under  the  classicalpoint-to-point  communication  model,  it  is  well-known  [7]  that  the  following  twoconditions  are  both  necessary  and  sufficient  to  achieve  Byzantine  consensusamong  $n$  nodes  in  the  presence  of  up  to  $f$  Byzantine  faulty  nodes:  $n  ge3f+1$  and  vertex  connectivity  at  least  $2f+1$.  In  the  classical  point-to-pointcommunication  model,  it  is  possible  for  a  faulty  node  to  equivocate,  i.e.,transmit  conflicting  information  to  different  neighbors.  Such  equivocation  ispossible  because  messages  sent  by  a  node  to  one  of  its  neighbors  are  notoverheard  by  other  neighbors.</p><p>This  paper  considers  the  local  broadcast  model.  In  contrast  to  thepoint-to-point  communication  model,  in  the  local  broadcast  model,  messages  sentby  a  node  are  received  identically  by  all  of  its  neighbors.  Thus,  under  thelocal  broadcast  model,  attempts  by  a  node  to  send  conflicting  information  canbe  detected  by  its  neighbors.  Under  this  model,  we  show  that  the  following  twoconditions  are  both  necessary  and  sufficient  for  Byzantine  consensus:  vertexconnectivity  at  least  $lfloor  3f/2  floor  +  1$  and  minimum  node  degree  atleast  $2f$.  Observe  that  the  local  broadcast  model  results  in  a  lowerrequirement  for  connectivity  and  the  number  of  nodes  $n$,  as  compared  to  thepoint-to-point  communication  model.</p><p>We  extend  the  above  results  to  a  hybrid  model  that  allows  some  of  theByzantine  faulty  nodes  to  equivocate.  The  hybrid  model  bridges  the  gap  betweenthe  point-to-point  and  local  broadcast  models,  and  helps  to  preciselycharacterize  the  trade-off  between  equivocation  and  network  requirements.</p>
http://arxiv.org/abs/1903.11678|Tree  Search  vs  Optimization  Approaches  for  Map  Generation.  (arXiv:1903.11678v1  [cs.AI])|<p>Search-based  procedural  content  generation  uses  stochastic  globaloptimization  algorithms  to  search  spaces  of  game  content.  However,  it  has  beenfound  that  tree  search  can  be  competitive  with  evolution  on  certainoptimization  problems.  We  investigate  the  applicability  of  several  tree  searchmethods  to  map  generation  and  compare  them  systematically  with  severaloptimization  algorithms,  including  evolutionary  algorithms.  For  purposes  ofcomparison,  we  use  a  simplified  map  generation  problem  where  only  passable  andimpassable  tiles  exist,  three  different  map  representations,  and  a  set  ofobjectives  that  are  representative  of  those  commonly  found  in  actual  levelgeneration  problem.  While  the  results  suggest  that  evolutionary  algorithmsproduce  good  maps  faster,  several  tree  search  methods  can  perform  very  wellgiven  sufficient  time,  and  there  are  interesting  differences  in  the  characterof  the  generated  maps  depending  on  the  algorithm  chosen,  even  for  the  samerepresentation  and  objective.</p>
http://arxiv.org/abs/1903.11680|Gradient  Descent  with  Early  Stopping  is  Provably  Robust  to  Label  Noise  for  Overparameterized  Neural  Networks.  (arXiv:1903.11680v1  [cs.LG])|<p>Modern  neural  networks  are  typically  trained  in  an  over-parameterized  regimewhere  the  parameters  of  the  model  far  exceed  the  size  of  the  training  data.  Dueto  over-parameterization  these  neural  networks  in  principle  have  the  capacityto  (over)fit  any  set  of  labels  including  pure  noise.  Despite  this  high  fittingcapacity,  somewhat  paradoxically,  neural  network  models  trained  via  first-ordermethods  continue  to  predict  well  on  yet  unseen  test  data.  In  this  paper  we  takea  step  towards  demystifying  this  phenomena.  In  particular  we  show  that  firstorder  methods  such  as  gradient  descent  are  provably  robust  to  noise/corruptionon  a  constant  fraction  of  the  labels  despite  over-parametrization  under  a  richdataset  model.  In  particular:  i)  First,  we  show  that  in  the  first  fewiterations  where  the  updates  are  still  in  the  vicinity  of  the  initializationthese  algorithms  only  fit  to  the  correct  labels  essentially  ignoring  the  noisylabels.  ii)  Secondly,  we  prove  that  to  start  to  overfit  to  the  noisy  labelsthese  algorithms  must  stray  rather  far  from  from  the  initial  model  which  canonly  occur  after  many  more  iterations.  Together,  these  show  that  gradientdescent  with  early  stopping  is  provably  robust  to  label  noise  and  shed  light  onempirical  robustness  of  deep  networks  as  well  as  commonly  adopted  heuristics  toprevent  overfitting.</p>
