link|title|description
http://arxiv.org/abs/1710.10718|An  Approximation  Algorithm  for  Optimal  Clique  Cover  Delivery  in  Coded  Caching.  (arXiv:1710.10718v3  [cs.IT]  UPDATED)|"<p>Coded  caching  can  significantly  reduce  the  communication  bandwidthrequirement  for  satisfying  users'  demands  by  utilizing  the  multicasting  gainamong  multiple  users.  Most  existing  works  assume  that  the  users  follow  theprescriptions  for  content  placement  made  by  the  system.  However,  users  mayprefer  to  decide  what  files  to  cache.  To  address  this  issue,  we  consider  anetwork  consisting  of  a  file  server  connected  through  a  shared  link  to  $K$users,  each  equipped  with  a  cache  which  has  been  already  filled  arbitrarily.Given  an  arbitrary  content  placement,  the  goal  is  to  find  a  delivery  strategyfor  the  server  that  minimizes  the  load  of  the  shared  link.  In  this  paper,  wefocus  on  a  specific  class  of  coded  multicasting  delivery  schemes  known  as  the""clique  cover  delivery  scheme"".  We  first  formulate  the  optimal  clique  coverdelivery  problem  as  a  combinatorial  optimization  problem.  Using  a  connectionwith  the  weighted  set  cover  problem,  we  propose  an  approximation  algorithm  andshow  that  it  provides  an  approximation  ratio  of  $(1  +  log  K)$,  while  theapproximation  ratio  for  the  existing  coded  delivery  schemes  is  linear  in  $K$.Numerical  simulations  show  that  our  proposed  algorithm  provides  a  considerablebandwidth  reduction  over  the  existing  coded  delivery  schemes  for  almost  allcontent  placement  schemes.</p>"
http://arxiv.org/abs/1711.00113|Proving  Soundness  of  Extensional  Normal-Form  Bisimilarities.  (arXiv:1711.00113v4  [cs.LO]  UPDATED)|<p>Normal-form  bisimilarity  is  a  simple,  easy-to-use  behavioral  equivalence  thatrelates  terms  in  $lambda$-calculi  by  decomposing  their  normal  forms  intobisimilar  subterms.  Moreover,  it  typically  allows  for  powerful  up-totechniques,  such  as  bisimulation  up  to  context,  which  simplify  bisimulationproofs  even  further.  However,  proving  soundness  of  these  relations  becomescomplicated  in  the  presence  of  $eta$-expansion  and  usually  relies  on  ad  hocproof  methods  which  depend  on  the  language.  In  this  paper  we  propose  a  moresystematic  proof  method  to  show  that  an  extensional  normal-form  bisimilarityalong  with  its  corresponding  up  to  context  technique  are  sound.  We  illustrateour  technique  with  three  calculi:  the  call-by-value  $lambda$-calculus,  thecall-by-value  $lambda$-calculus  with  the  delimited-control  operators  shift  andreset,  and  the  call-by-value  $lambda$-calculus  with  the  abortive  controloperators  call/cc  and  abort.  In  the  first  two  cases,  there  was  previously  nosound  up  to  context  technique  validating  the  $eta$-law,  whereas  no  theory  ofnormal-form  bisimulations  for  a  calculus  with  call/cc  and  abort  has  beenpresented  before.  Our  results  have  been  fully  formalized  in  the  Coq  proofassistant.</p>
http://arxiv.org/abs/1712.05500|Ergodicity  of  some  classes  of  cellular  automata  subject  to  noise.  (arXiv:1712.05500v3  [math.PR]  UPDATED)|<p>Cellular  automata  (CA)  are  dynamical  systems  on  symbolic  configurations  onthe  lattice.  They  are  also  used  as  models  of  massively  parallel  computers.  Asdynamical  systems,  one  would  like  to  understand  the  effect  of  small  randomperturbations  on  the  dynamics  of  CA.  As  models  of  computation,  they  can  be  usedto  study  the  reliability  of  computation  against  noise.</p><p>We  consider  various  families  of  CA  (nilpotent,  permutive,  gliders,  CA  with  aspreading  symbol,  surjective,  algebraic)  and  prove  that  they  are  highlyunstable  against  noise,  meaning  that  they  forget  their  initial  conditions  underslightest  positive  noise.  This  is  manifested  as  the  ergodicity  of  the  resultingprobabilistic  CA.  The  proofs  involve  a  collection  of  different  techniques(couplings,  entropy,  Fourier  analysis),  depending  on  the  dynamical  propertiesof  the  underlying  deterministic  CA  and  the  type  of  noise.</p>
http://arxiv.org/abs/1801.04613|Software  Defined  Networks  based  Smart  Grid  Communication:  A  Comprehensive  Survey.  (arXiv:1801.04613v4  [cs.NI]  UPDATED)|<p>The  current  power  grid  is  no  longer  a  feasible  solution  due  toever-increasing  user  demand  of  electricity,  old  infrastructure,  and  reliabilityissues  and  thus  require  transformation  to  a  better  grid  a.k.a.,  smart  grid(SG).  The  key  features  that  distinguish  SG  from  the  conventional  electricalpower  grid  are  its  capability  to  perform  two-way  communication,  demand  sidemanagement,  and  real  time  pricing.  Despite  all  these  advantages  that  SG  willbring,  there  are  certain  issues  which  are  specific  to  SG  communication  system.For  instance,  network  management  of  current  SG  systems  is  complex,  timeconsuming,  and  done  manually.  Moreover,  SG  communication  (SGC)  system  is  builton  different  vendor  specific  devices  and  protocols.  Therefore,  the  current  SGsystems  are  not  protocol  independent,  thus  leading  to  interoperability  issue.Software  defined  network  (SDN)  has  been  proposed  to  monitor  and  manage  thecommunication  networks  globally.  This  article  serves  as  a  comprehensive  surveyon  SDN-based  SGC.  In  this  article,  we  first  discuss  taxonomy  of  advantages  ofSDNbased  SGC.We  then  discuss  SDN-based  SGC  architectures,  along  with  casestudies.  Our  article  provides  an  in-depth  discussion  on  routing  schemes  forSDN-based  SGC.  We  also  provide  detailed  survey  of  security  and  privacy  schemesapplied  to  SDN-based  SGC.  We  furthermore  present  challenges,  open  issues,  andfuture  research  directions  related  to  SDN-based  SGC.</p>
http://arxiv.org/abs/1801.07528|Computer-Assisted  Proving  of  Combinatorial  Conjectures  Over  Finite  Domains:  A  Case  Study  of  a  Chess  Conjecture.  (arXiv:1801.07528v4  [cs.LO]  UPDATED)|<p>There  are  several  approaches  for  using  computers  in  deriving  mathematicalproofs.  For  their  illustration,  we  provide  an  in-depth  study  of  using  computersupport  for  proving  one  complex  combinatorial  conjecture  --  correctness  of  astrategy  for  the  chess  KRK  endgame.  The  final,  machine  verifiable,  resultpresented  in  this  paper  is  that  there  is  a  winning  strategy  for  white  in  theKRK  endgame  generalized  to  $n  	imes  n$  board  (for  natural  $n$  greater  than$3$).  We  demonstrate  that  different  approaches  for  computer-based  theoremproving  work  best  together  and  in  synergy  and  that  the  technology  currentlyavailable  is  powerful  enough  for  providing  significant  help  to  humans  derivingcomplex  proofs.</p>
http://arxiv.org/abs/1802.04634|Lattice  Functions  for  the  Analysis  of  Analog-to-Digital  Conversion.  (arXiv:1802.04634v2  [eess.SP]  UPDATED)|<p>Analog-to-digital  (A/D)  converters  are  the  common  interface  between  analogsignals  and  the  domain  of  digital  discrete-time  signal  processing.  In  essence,this  domain  simultaneously  incorporates  quantization  both  in  amplitude  andtime,  i.e.  amplitude  quantization  and  uniform  time  sampling.  Thus,  we  view  A/Dconversion  as  a  sampling  process  in  both  the  time  and  amplitude  domains  basedon  the  observation  that  the  underlying  continuous-time  signals  representingdigital  sequences  can  be  sampled  in  a  lattice---i.e.  at  points  restricted  tolie  on  a  uniform  grid  both  in  time  and  amplitude.  We  refer  to  them  as  latticefunctions.  This  is  in  contrast  with  the  traditional  approach  based  on  theclassical  sampling  theorem  and  quantization  error  analysis.  The  latter  has  beenmainly  addressed  with  the  help  of  probabilistic  models,  or  deterministic  oneseither  confined  to  very  particular  scenarios  or  considering  worst-caseassumptions.  In  this  paper,  we  provide  a  deterministic  theoretical  analysis  andframework  for  the  functions  involved  in  digital  discrete-time  processing.  Weshow  that  lattice  functions  possess  a  rich  analytic  structure  in  the  context  ofintegral-valued  entire  functions  of  exponential  type.  We  derive  set  andspectral  properties  of  this  class  of  functions.  This  allows  us  to  prove  in  adeterministic  way  and  for  general  bandlimited  functions  a  fundamental  lowerbound  on  the  maximum  frequency  component  introduced  by  quantization  that  isindependent  of  the  resolution  of  the  quantizer.</p>
http://arxiv.org/abs/1802.04672|Delta-Ramp  Encoder  for  Amplitude  Sampling  and  its  Interpretation  as  Time  Encoding.  (arXiv:1802.04672v2  [eess.SP]  UPDATED)|<p>The  theoretical  basis  for  conventional  acquisition  of  bandlimited  signalstypically  relies  on  uniform  time  sampling  and  assumes  infinite-precisionamplitude  values.  In  this  paper,  we  explore  signal  representation  and  recoverybased  on  uniform  amplitude  sampling  with  assumed  infinite  precision  timinginformation.  The  approach  is  based  on  the  delta-ramp  encoder  which  consists  ofapplying  a  one-level  level-crossing  detector  to  the  result  of  adding  anappropriate  sawtooth-like  waveform  to  the  input  signal.  The  output  samples  arethe  time  instants  of  these  level  crossings,  thus  representing  a  time-encodedversion  of  the  input  signal.  For  theoretical  purposes,  this  system  can  beequivalently  analyzed  by  reversibly  transforming  through  ramp  addition  anonmonotonic  input  signal  into  a  monotonic  one  which  is  then  uniformly  sampledin  amplitude.  The  monotonic  function  is  then  represented  by  the  times  at  whichthe  signal  crosses  a  predefined  and  equally-spaced  set  of  amplitude  values.  Werefer  to  this  technique  as  amplitude  sampling.  The  time  sequence  generated  canbe  interpreted  alternatively  as  nonuniform  time  sampling  of  the  original  sourcesignal.  We  derive  duality  and  frequency-domain  properties  for  the  functionsinvolved  in  the  transformation.  Iterative  algorithms  are  proposed  andimplemented  for  recovery  of  the  original  source  signal.  As  indicated  in  thesimulations,  the  proposed  iterative  amplitude-sampling  algorithm  achieves  afaster  convergence  rate  than  frame-based  reconstruction  for  nonuniformsampling.  The  performance  can  also  be  improved  by  appropriate  choice  of  theparameters  while  maintaining  the  same  sampling  density.</p>
http://arxiv.org/abs/1803.08988|Evaluating  Sentence-Level  Relevance  Feedback  for  High-Recall  Information  Retrieval.  (arXiv:1803.08988v2  [cs.IR]  UPDATED)|"<p>This  study  uses  a  novel  simulation  framework  to  evaluate  whether  the  time  andeffort  necessary  to  achieve  high  recall  using  active  learning  is  reduced  bypresenting  the  reviewer  with  isolated  sentences,  as  opposed  to  full  documents,for  relevance  feedback.  Under  the  weak  assumption  that  more  time  and  effort  isrequired  to  review  an  entire  document  than  a  single  sentence,  simulationresults  indicate  that  the  use  of  isolated  sentences  for  relevance  feedback  canyield  comparable  accuracy  and  higher  efficiency,  relative  to  thestate-of-the-art  Baseline  Model  Implementation  (BMI)  of  the  AutoTAR  ContinuousActive  Learning  (""CAL"")  method  employed  in  the  TREC  2015  and  2016  Total  RecallTrack.</p>"
http://arxiv.org/abs/1805.04772|VAMS:  Verifiable  Auditing  of  Access  to  Confidential  Data.  (arXiv:1805.04772v4  [cs.CR]  UPDATED)|<p>The  sharing  of  personal  data  has  the  potential  to  bring  sub-stantial  benefitsboth  to  individuals  and  society,  but  only  if  people  have  confidence  that  theirdata  will  not  be  used  in-appropriately.  As  more  sensitive  data  is  consideredfor  sharing  (e.g.,  communication  records  and  medical  records)  and  used  to  makeimportant  decisions,  there  is  a  growing  need  for  transparency  in  the  way  thatthe  data  is  processed,  while  protecting  the  privacy  of  individuals  and  theintegrity  of  their  data.  We  propose  a  system,  VAMS,  which  allows  individuals  tocheck  accesses  to  their  personal  data,  and  enables  auditors  to  detectviolations  of  policy.  Furthermore,  our  system  protects  the  privacy  ofindividuals  and  organizations,  while  allowing  published  statistics  to  bepublicly  verified.  We  demonstrate  the  practicality  of  our  system  with  twoprototypes,  based  on  Hyperledger  Fabric  and  Trillian.</p>
http://arxiv.org/abs/1805.10505|Cookie  Synchronization:  Everything  You  Always  Wanted  to  Know  But  Were  Afraid  to  Ask.  (arXiv:1805.10505v2  [cs.IR]  UPDATED)|<p>User  data  is  the  primary  input  of  digital  advertising,  fueling  the  freeInternet  as  we  know  it.  As  a  result,  web  companies  invest  a  lot  in  elaboratetracking  mechanisms  to  acquire  user  data  that  can  sell  to  data  markets  andadvertisers.  However,  with  same-origin  policy,  and  cookies  as  a  primaryidentification  mechanism  on  the  web,  each  tracker  knows  the  same  user  with  adifferent  ID.  To  mitigate  this,  Cookie  Synchronization  (CSync)  came  to  therescue,  facilitating  an  information  sharing  channel  between  third  parties  thatmay  or  not  have  direct  access  to  the  website  the  user  visits.  In  thebackground,  with  CSync,  they  merge  user  data  they  own,  but  also  reconstruct  auser's  browsing  history,  bypassing  the  same  origin  policy.  In  this  paper,  weperform  a  first  to  our  knowledge  in-depth  study  of  CSync  in  the  wild,  using  ayear-long  weblog  from  850  real  mobile  users.  Through  our  study,  we  aim  tounderstand  the  characteristics  of  the  CSync  protocol  and  the  impact  it  has  onweb  users'  privacy.  For  this,  we  design  and  implement  CONRAD,  a  holisticmechanism  to  detect  CSync  events  at  real  time,  and  the  privacy  loss  on  the  userside,  even  when  the  synced  IDs  are  obfuscated.  Using  CONRAD,  we  find  that  97%of  the  regular  web  users  are  exposed  to  CSync:  most  of  them  within  the  firstweek  of  their  browsing,  and  the  median  userID  gets  leaked,  on  average,  to  3.5different  domains.  Finally,  we  see  that  CSync  increases  the  number  of  domainsthat  track  the  user  by  a  factor  of  6.75.</p>
http://arxiv.org/abs/1807.00056|Fundamental  Limits  of  Decentralized  Data  Shuffling.  (arXiv:1807.00056v3  [cs.IT]  UPDATED)|<p>Data  shuffling  of  training  data  among  different  computing  nodes  (workers)  hasbeen  identified  as  a  core  element  to  improve  the  statistical  performance  ofmodern  large  scale  machine  learning  algorithms.  Data  shuffling  is  oftenconsidered  as  one  of  the  most  significant  bottlenecks  in  such  systems  due  tothe  heavy  communication  load.  Under  a  master-worker  architecture  (where  amaster  has  access  to  the  entire  dataset  and  only  communication  between  themaster  and  the  workers  is  allowed)  coding  has  been  recently  proved  toconsiderably  reduce  the  communication  load.  This  work  considers  a  differentcommunication  paradigm  referred  to  as  decentralized  data  shuffling,  whereworkers  are  allowed  to  communicate  with  one  another  via  a  shared  link.  Thedecentralized  data  shuffling  problem  has  two  phases:  workers  communicate  witheach  other  during  the  data  shuffling  phase,  and  then  workers  update  theirstored  content  during  the  storage  phase.  For  the  case  of  uncoded  storage  (i.e.,each  worker  directly  stores  a  subset  of  bits  of  the  dataset),  this  paperproposes  converse  and  achievable  bounds  that  are  to  within  a  factor  of  3/2  ofone  another.  The  proposed  schemes  are  also  exactly  optimal  under  the  constraintof  uncoded  storage  for  either  large  memory  size  or  at  most  four  workers  in  thesystem.  As  a  by-product,  a  novel  distributed  clique-covering  scheme  is  proposedfor  distributed  broadcast  with  side  information-a  setting  that  includes  asspecial  cases  decentralized  data  shuffling,  distributed  index  coding,  anddevice-to-device  coded  caching.</p>
http://arxiv.org/abs/1807.01417|The  Implementation  of  the  Colored  Abstract  Simplicial  Complex  and  its  Application  to  Mesh  Generation.  (arXiv:1807.01417v2  [cs.MS]  UPDATED)|<p>We  introduce  CASC:  a  new,  modern,  and  header-only  C++  library  which  providesa  data  structure  to  represent  arbitrary  dimension  abstract  simplicial  complexes(ASC)  with  user-defined  classes  stored  directly  on  the  simplices  at  eachdimension.  This  is  accomplished  by  using  the  latest  C++  language  featuresincluding  variadic  template  parameters  introduced  in  C++11  and  automaticfunction  return  type  deduction  from  C++14.  Effectively  CASC  decouples  therepresentation  of  the  topology  from  the  interactions  of  user  data.  We  presentthe  innovations  and  design  principles  of  the  data  structure  and  relatedalgorithms.  This  includes  a  metadata  aware  decimation  algorithm  which  isgeneral  for  collapsing  simplices  of  any  dimension.  We  also  present  an  exampleapplication  of  this  library  to  represent  an  orientable  surface  mesh.</p>
http://arxiv.org/abs/1807.07648|"On  Chebotar""ev's  nonvanishing  minors  theorem  and  the  Bir'o-Meshulam-Tao  discrete  uncertainty  principle.  (arXiv:1807.07648v2  [math.CA]  UPDATED)"|"<p>Chebotar""ev's  theorem  says  that  every  minor  of  a  discrete  Fourier  matrix  ofprime  order  is  nonzero.  We  prove  a  generalization  of  this  result  that  includesanalogues  for  discrete  cosine  and  discrete  sine  matrices  as  special  cases.  Wethen  establish  a  generalization  of  the  Bir'o-Meshulam-Tao  uncertaintyprinciple  to  functions  with  symmetries  that  arise  from  certain  group  actions,with  some  of  the  simplest  examples  being  even  and  odd  functions.  We  show  thatour  result  is  best  possible  and  in  some  cases  is  stronger  than  that  ofBir'o-Meshulam-Tao.  Some  of  these  results  hold  in  certain  circumstances  fornon-prime  fields;  Gauss  sums  play  a  central  role  in  such  investigations.</p>"
http://arxiv.org/abs/1807.07978|Prior  Convictions:  Black-Box  Adversarial  Attacks  with  Bandits  and  Priors.  (arXiv:1807.07978v3  [stat.ML]  UPDATED)|<p>We  study  the  problem  of  generating  adversarial  examples  in  a  black-boxsetting  in  which  only  loss-oracle  access  to  a  model  is  available.  We  introducea  framework  that  conceptually  unifies  much  of  the  existing  work  on  black-boxattacks,  and  we  demonstrate  that  the  current  state-of-the-art  methods  areoptimal  in  a  natural  sense.  Despite  this  optimality,  we  show  how  to  improveblack-box  attacks  by  bringing  a  new  element  into  the  problem:  gradient  priors.We  give  a  bandit  optimization-based  algorithm  that  allows  us  to  seamlesslyintegrate  any  such  priors,  and  we  explicitly  identify  and  incorporate  twoexamples.  The  resulting  methods  use  two  to  four  times  fewer  queries  and  failtwo  to  five  times  less  often  than  the  current  state-of-the-art.</p>
http://arxiv.org/abs/1807.10936|Unsupervised  Learning  of  a  Hierarchical  Spiking  Neural  Network  for  Optical  Flow  Estimation:  From  Events  to  Global  Motion  Perception.  (arXiv:1807.10936v2  [cs.CV]  UPDATED)|<p>The  combination  of  spiking  neural  networks  and  event-based  vision  sensorsholds  the  potential  of  highly  efficient  and  high-bandwidth  optical  flowestimation.  This  paper  presents  the  first  hierarchical  spiking  architecture  inwhich  motion  (direction  and  speed)  selectivity  emerges  in  an  unsupervisedfashion  from  the  raw  stimuli  generated  with  an  event-based  camera.  A  noveladaptive  neuron  model  and  stable  spike-timing-dependent  plasticity  formulationare  at  the  core  of  this  neural  network  governing  its  spike-based  processing  andlearning,  respectively.  After  convergence,  the  neural  architecture  exhibits  themain  properties  of  biological  visual  motion  systems,  namely  feature  extractionand  local  and  global  motion  perception.  Convolutional  layers  with  inputsynapses  characterized  by  single  and  multiple  transmission  delays  are  employedfor  feature  and  local  motion  perception,  respectively;  while  global  motionselectivity  emerges  in  a  final  fully-connected  layer.  The  proposed  solution  isvalidated  using  synthetic  and  real  event  sequences.  Along  with  this  paper,  weprovide  the  cuSNN  library,  a  framework  that  enables  GPU-accelerated  simulationsof  large-scale  spiking  neural  networks.  Source  code  and  samples  are  availableat  https://github.com/tudelft/cuSNN.</p>
http://arxiv.org/abs/1808.00441|Matrix  completion  and  extrapolation  via  kernel  regression.  (arXiv:1808.00441v2  [stat.ML]  UPDATED)|<p>Matrix  completion  and  extrapolation  (MCEX)  are  dealt  with  here  overreproducing  kernel  Hilbert  spaces  (RKHSs)  in  order  to  account  for  priorinformation  present  in  the  available  data.  Aiming  at  a  faster  andlow-complexity  solver,  the  task  is  formulated  as  a  kernel  ridge  regression.  Theresultant  MCEX  algorithm  can  also  afford  online  implementation,  while  the  classof  kernel  functions  also  encompasses  several  existing  approaches  to  MC  withprior  information.  Numerical  tests  on  synthetic  and  real  datasets  show  that  thenovel  approach  performs  faster  than  widespread  methods  such  as  alternatingleast  squares  (ALS)  or  stochastic  gradient  descent  (SGD),  and  that  the  recoveryerror  is  reduced,  especially  when  dealing  with  noisy  data.</p>
http://arxiv.org/abs/1808.02871|Random  directions  stochastic  approximation  with  deterministic  perturbations.  (arXiv:1808.02871v2  [math.OC]  UPDATED)|<p>We  introduce  deterministic  perturbation  schemes  for  the  recently  proposedrandom  directions  stochastic  approximation  (RDSA)  [17],  and  propose  newfirst-order  and  second-order  algorithms.  In  the  latter  case,  these  are  thefirst  second-order  algorithms  to  incorporate  deterministic  perturbations.  Weshow  that  the  gradient  and/or  Hessian  estimates  in  the  resulting  algorithmswith  deterministic  perturbations  are  asymptotically  unbiased,  so  that  thealgorithms  are  provably  convergent.  Furthermore,  we  derive  convergence  rates  toestablish  the  superiority  of  the  first-order  and  second-order  algorithms,  forthe  special  case  of  a  convex  and  quadratic  optimization  problem,  respectively.Numerical  experiments  are  used  to  validate  the  theoretical  results.</p>
http://arxiv.org/abs/1808.06570|Detecting  cognitive  impairments  by  agreeing  on  interpretations  of  linguistic  features.  (arXiv:1808.06570v3  [cs.CL]  UPDATED)|<p>Linguistic  features  have  shown  promising  applications  for  detecting  variouscognitive  impairments.  To  improve  detection  accuracies,  increasing  the  amountof  data  or  the  number  of  linguistic  features  have  been  two  applicableapproaches.  However,  acquiring  additional  clinical  data  can  be  expensive,  andhand-crafting  features  is  burdensome.  In  this  paper,  we  take  a  third  approach,proposing  Consensus  Networks  (CNs),  a  framework  to  classify  after  reachingagreements  between  modalities.  We  divide  linguistic  features  intonon-overlapping  subsets  according  to  their  modalities,  and  let  neural  networkslearn  low-dimensional  representations  that  agree  with  each  other.  Theserepresentations  are  passed  into  a  classifier  network.  All  neural  networks  areoptimized  iteratively.</p><p>In  this  paper,  we  also  present  two  methods  that  improve  the  performance  ofCNs.  We  then  present  ablation  studies  to  illustrate  the  effectiveness  ofmodality  division.  To  understand  further  what  happens  in  CNs,  we  visualize  therepresentations  during  training.  Overall,  using  all  of  the  413  linguisticfeatures,  our  models  significantly  outperform  traditional  classifiers,  whichare  used  by  the  state-of-the-art  papers.</p>
